{
  "project": "bt",
  "counts": {
    "open": 1,
    "blocked": 1,
    "in_progress": 0,
    "closed_30d": 1
  },
  "priority": {
    "p0": 1,
    "p1": 0
  },
  "velocity": {
    "closures_7d": 1,
    "closures_30d": 1,
    "trend": "flat"
  },
  "health_score": 0.5,
  "stalest": {
    "id": "bt-1",
    "title": "bt consumer blocked cross-project",
    "priority": 0,
    "age_days": 0
  }
}
